<?xml version="1.0" encoding="utf-8"?>
<!DOCTYPE Annotation PUBLIC "-//GENIA//DTD GENIA ANNOTATION COREF 1.0//EN" "GENIA_coref_10.dtd">
<?xml-stylesheet type="text/css" href="GENIA_coref_10.css"?>
<Annotation annotates="http://www.ncbi.nlm.nih.gov/entrez/eutils/efetch.fcgi?db=pubmed&amp;amp;retmode=xml&amp;amp;rettype=medline&amp;amp;id=8622971">
<PubmedArticleSet>
<PubmedArticle>
<MedlineCitation>
<PMID>8622971</PMID>
<Article>
<ArticleTitle>
<sentence id="S1">cAMP inducibility of <coref id="C1">transcriptional repressor ICER</coref> in developing and mature human T lymphocytes [published erratum appears in Proc Natl Acad Sci U S A 1996 Jul 23;93(15):8154]</sentence>
</ArticleTitle>
<Abstract>
<AbstractText>
<sentence id="S2">Stimulation of the <coref id="C2">cAMP-</coref>dependent signaling pathway exerts an inhibitory effect on the proliferation and effector functions of <coref id="C3">T cells</coref>.</sentence>
<sentence id="S3">The ability of <coref ref="C3" type="IDENT" id="C4">T cells</coref> to form high intracellular levels of <coref ref="C2" type="IDENT" id="C5">cAMP</coref> is acquired during development in the human thymus and is retained by the majority of mature peripheral T lymphocytes.</sentence>
<sentence id="S4">Here we show that elevated cAMP levels in <coref ref="C4" type="IDENT" id="C6">T cells</coref> correlate with the expression of <coref ref="C1" type="IDENT" id="C7">the potent transcriptional repressor ICER</coref> (inducible cAMP early repressor) previously described in the hypothalamic-pituitary-gonadal axis.</sentence>
<sentence id="S5">Further, in transcriptional assays in vivo, <coref ref="C1" type="IDENT" id="C8">ICER</coref> inhibits calcineurin-mediated expression of the interleukin 2 promoter as well as Tax-mediated transactivation of the human T-lymphotropic virus type I (HTLV-I) promoter.</sentence>
<sentence id="S6">Thus, the induction of <coref ref="C8" type="IDENT" id="C9">ICER</coref> in <coref ref="C6" type="IDENT" id="C10">T cells</coref> may play an important role in the <coref ref="C5" type="IDENT" id="C11">cAMP-</coref>induced quiescence and the persistent latency of HTLV-I.</sentence>
</AbstractText>
</Abstract>
</Article>
</MedlineCitation>
</PubmedArticle>
</PubmedArticleSet>
</Annotation>
