<?xml version="1.0" encoding="utf-8"?>
<!DOCTYPE Annotation PUBLIC "-//GENIA//DTD GENIA ANNOTATION COREF 1.0//EN" "GENIA_coref_10.dtd">
<?xml-stylesheet type="text/css" href="GENIA_coref_10.css"?>
<Annotation annotates="http://www.ncbi.nlm.nih.gov/entrez/eutils/efetch.fcgi?db=pubmed&amp;amp;retmode=xml&amp;amp;rettype=medline&amp;amp;id=7887301">
<PubmedArticleSet>
<PubmedArticle>
<MedlineCitation>
<PMID>7887301</PMID>
<Article>
<ArticleTitle>
<sentence id="S1">Cloning and characterization of <coref id="C1">NF-ATc</coref> and <coref id="C2">NF-ATp</coref>: <coref min="components" id="C3">the cytoplasmic components of NF-AT</coref>.</sentence>
</ArticleTitle>
<Abstract>
<AbstractText>
<sentence id="S2">Present evidence indicates <coref min="pathway" id="C4">a pathway of signal transmission in T cells</coref> <coref ref="C4" type="RELAT" id="C5">that</coref> is outlined in figure 1.</sentence>
<sentence id="S3">The elevation in <coref id="C6">intracellular calcium</coref> <coref ref="C6" type="RELAT" id="C7">that</coref> is induced by interactions at the antigen receptor leads to the activation of <coref min="calcineurin" id="C8">the calcium-dependent phosphatase calcineurin</coref>.</sentence>
<sentence id="S4">This in turn leads to the nuclear association of the cytosolic component of <coref ref="C1" type="IDENT" id="C9">NF-ATc</coref>.</sentence>
<sentence id="S5">The activation of <coref ref="C8" type="IDENT" id="C10">calcineurin</coref> and <coref min="import" id="C11">the nuclear import of <coref ref="C9" type="IDENT" id="C12">NF-ATc</coref></coref> can both be blocked by <coref id="C13">cyclosporin A or FK506</coref> in complex with <coref ref="C13" type="PRON" id="C14">their</coref> respective immunophilins.</sentence>
<sentence id="S6">Once in the nucleus, <coref ref="C12" type="IDENT" id="C15">NF-ATc</coref> interacts with <coref id="C16">NF-ATn</coref> to form an active transcriptional complex.</sentence>
<sentence id="S7"><coref ref="C16" type="IDENT" id="C17">NF-ATn</coref> is a ubiquitous protein, can be synthesized in response to PMA, and has many similarities to AP-1.</sentence>
<sentence id="S8"><coref id="C18">The mechanism</coref> by <coref ref="C18" type="RELAT" id="C19">which</coref> <coref ref="C15" type="IDENT" id="C20">NF-ATc</coref> enters the nucleus is unknown, and although it appears to require <coref ref="C10" type="IDENT" id="C21">calcineurin</coref>, <coref ref="C20" type="IDENT" id="C22">NF-ATc</coref> has not yet been shown to be an in vivo substrate of <coref ref="C21" type="IDENT" id="C23">calcineurin</coref>.</sentence>
<sentence id="S9">Alternative mechanisms include <coref id="C24">the possibility</coref> <coref ref="C24" type="RELAT" id="C25">that</coref> <coref ref="C22" type="IDENT" id="C26">NF-ATc</coref> operates on some cytoplasmic anchor or <coref ref="C24" type="RELAT" id="C27">that</coref> <coref id="C28">other proteins</coref> <coref ref="C28" type="RELAT" id="C29">that</coref> are controlled by calcineurin carry out <coref ref="C11" min="import" type="IDENT" id="C30">the nuclear import of <coref ref="C26" type="IDENT" id="C31">NF-ATc</coref></coref>.</sentence>
<sentence id="S10">Although <coref ref="C2" type="IDENT" id="C32">NF-ATp</coref> copurifies with <coref ref="C31" type="IDENT" id="C33">NF-ATc</coref>, there is as yet no understanding of how <coref ref="C32" type="IDENT" id="C34">NF-ATp</coref> is functioning in vivo.</sentence>
<sentence id="S11">Now that <coref ref="C3" type="IDENT" id="C35">these proteins</coref> are purified and cloned, the major goals will be to understand <coref ref="C35" type="PRON" id="C36">their</coref> role and the roles of other family members in thymic development.</sentence>
</AbstractText>
</Abstract>
</Article>
</MedlineCitation>
</PubmedArticle>
</PubmedArticleSet>
</Annotation>
