<?xml version="1.0" encoding="utf-8"?>
<!DOCTYPE Annotation PUBLIC "-//GENIA//DTD GENIA ANNOTATION COREF 1.0//EN" "GENIA_coref_10.dtd">
<?xml-stylesheet type="text/css" href="GENIA_coref_10.css"?>
<Annotation annotates="http://www.ncbi.nlm.nih.gov/entrez/eutils/efetch.fcgi?db=pubmed&amp;amp;retmode=xml&amp;amp;rettype=medline&amp;amp;id=7645237">
<PubmedArticleSet>
<PubmedArticle>
<MedlineCitation>
<PMID>7645237</PMID>
<Article>
<ArticleTitle>
<sentence id="S1">Restoration of <coref min="protein" id="C1">the Epstein-Barr virus ZEBRA protein</coref>'s capacity to disrupt latency by the addition of heterologous activation regions.</sentence>
</ArticleTitle>
<Abstract>
<AbstractText>
<sentence id="S2"><coref ref="C1" min="protein" type="IDENT" id="C2">The ZEBRA protein</coref> has a unique biological function among herpesviral proteins.</sentence>
<sentence id="S3">It is responsible for the disruption of Epstein-Barr virus (EBV) latency and the induction of the lytic cycle.</sentence>
<sentence id="S4"><coref id="C3">ZEBRA</coref> is <coref min="transcriptional-activator" id="C4">a bZIP transcriptional activator</coref> <coref ref="C4" type="RELAT" id="C5">which</coref> binds as a dimer to 7-bp response elements within EBV promoters and is directly involved in the stimulation of virus replication at the EBV lytic origin.</sentence>
<sentence id="S5">We have employed the ZEBRA/EBV biological system to test whether a heterologous activation domain can substitute for <coref min="domain" id="C6">another activation domain (the ZEBRA domain)</coref>.</sentence>
<sentence id="S6"><coref ref="C6" min="region" type="IDENT" id="C7">The ZEBRA activation region</coref> was replaced with the potent acid activation region from the herpes simplex virus VP16 protein or with the activation region of the EBV R protein.</sentence>
<sentence id="S7">Both chimeras were found to transactivate model and native promoters at equivalent or better levels than <coref ref="C3" type="IDENT" id="C8">ZEBRA</coref> <coref ref="C8" type="PRON" id="C9">itself</coref>.</sentence>
<sentence id="S8"><coref id="C10">Activation</coref> was not target- or cell-type dependent, nor was <coref ref="C10" type="PRON" id="C11">it</coref> dependent on the presence of virus.</sentence>
<sentence id="S9">These activation domains restored <coref ref="C8" type="IDENT" id="C12">ZEBRA</coref>'s ability to induce early antigen and to stimulate origin replication to <coref id="C13">levels</coref> <coref ref="C13" type="RELAT" id="C14">that</coref> were equal to or greater than <coref ref="C13" type="PRON" id="C15">those</coref> of wild type.</sentence>
<sentence id="S10">These studies suggest that the specificities of some of the known biological functions of <coref ref="C12" type="IDENT" id="C16">ZEBRA</coref> are not dependent upon the nature of the activation domain present within <coref ref="C16" type="IDENT" id="C17">ZEBRA</coref>.</sentence>
</AbstractText>
</Abstract>
</Article>
</MedlineCitation>
</PubmedArticle>
</PubmedArticleSet>
</Annotation>
