<?xml version="1.0" encoding="utf-8"?>
<!DOCTYPE Annotation PUBLIC "-//GENIA//DTD GENIA ANNOTATION COREF 1.0//EN" "GENIA_coref_10.dtd">
<?xml-stylesheet type="text/css" href="GENIA_coref_10.css"?>
<Annotation annotates="http://www.ncbi.nlm.nih.gov/entrez/eutils/efetch.fcgi?db=pubmed&amp;amp;retmode=xml&amp;amp;rettype=medline&amp;amp;id=10446065">
<PubmedArticleSet>
<PubmedArticle>
<MedlineCitation>
<PMID>10446065</PMID>
<Article>
<ArticleTitle>
<sentence id="S1">Transcriptional inhibition by <coref id="C21">interleukin-6</coref> of <coref min="receptor" id="C2">the class A macrophage scavenger receptor</coref> in <coref min="macrophages" id="C3">macrophages derived from human peripheral monocytes and the THP-1 monocytic cell line</coref>.</sentence>
</ArticleTitle>
<Abstract>
<AbstractText>
<sentence id="S2">Expression of <coref ref="C2" min="receptor" type="IDENT" id="C1">the class A macrophage scavenger receptor (MSR)</coref> contributes to the uptake of <coref min="lipoproteins" id="C23">modified low density lipoproteins (LDL)</coref> by <coref id="C4">macrophages</coref> and transformation of <coref ref="C23" type="IDENT" id="C24">these cells</coref> into <coref min="cells" id="C25">lipid-laden foam cells</coref>, <coref ref="C25" type="RELAT" id="C26">which</coref> characterize atherosclerosis.</sentence>
<sentence id="S3"><coref min="factors" id="C27">Many environmental factors</coref>, in particular, <coref ref="C27" min="factors" type="PART-WHOLE" id="C28">proinflammatory cytokines and growth factors</coref>, can exert regulatory effects on MSR expression, whereas <coref min="accumulation" id="C30">intracellular accumulation of cholesterol</coref> <coref ref="C30" type="PRON" id="C29">itself</coref> does not influence MSR levels to any considerable extent.</sentence>
<sentence id="S4">In the present study, by using an in vitro model, we examined whether stimulation with <coref ref="C21" type="IDENT" id="C31">interleukin-6 (IL-6)</coref>, <coref ref="C31" min="cytokine" type="APPOS" id="C32">an immunoregulatory, multipotential cytokine</coref>, modulates the expression and activities of <coref ref="C1" min="msr" type="IDENT" id="C7">the MSR</coref> in <coref ref="C4" type="IDENT" id="C8">macrophages</coref>.</sentence>
<sentence id="S5">When treated with <coref ref="C31" type="IDENT" id="C22">IL-6</coref>, <coref ref="C3" min="macrophages" type="IDENT" id="C9">macrophages derived from peripheral monocytes and phorbol 12-myristate 13-acetate (PMA)-differentiated THP-1 monocytic cells</coref> showed significantly reduced uptake and/or binding of <coref min="ligand" id="C33">the MSR ligand</coref>, <coref ref="C33" min="ldl" type="APPOS" id="C34">acetylated LDL</coref>.</sentence>
<sentence id="S6">This effect was paralleled by a reduction in the expression of MSR protein and mRNA.</sentence>
<sentence id="S7">Analysis of MSR promoter activity in THP-1 cells transfected with an <coref min="promotor" id="C16">MSR promoter-</coref>reporter gene construct demonstrated decreased activity of <coref ref="C16" min="promotor" type="IDENT" id="C17">the MSR promoter</coref> in <coref ref="C22" type="IDENT" id="C35">IL-6-</coref>treated THP-1 macrophages.</sentence>
<sentence id="S8">Electrophoretic mobility gel shift assay also showed a reduction in the binding of a transcription factor to the MSR promoter AP-1/ets elements in <coref ref="C35" type="IDENT" id="C36">IL-6-</coref>treated cells.</sentence>
<sentence id="S9">Thus, exposure to <coref ref="C36" type="IDENT" id="C37">IL-6</coref> may inhibit expression of <coref ref="C1" type="IDENT" id="C20">the class A MSR</coref> in differentiated macrophages at transcriptional levels.</sentence>
<sentence id="S10">This result suggests that <coref ref="C37" type="IDENT" id="C38">this cytokine</coref> may modulate foam cell formation during atherogenesis.</sentence>
</AbstractText>
</Abstract>
</Article>
</MedlineCitation>
</PubmedArticle>
</PubmedArticleSet>
</Annotation>
